{
    "schemaVersion": 1,
    "reviewer": "architecture-reviewer",
    "taskId": "secure-cred-store",
    "featureId": "secure-cred-store",
    "decision": "needs-human",
    "createdAt": "2026-06-02T07:11:00.000Z",
    "checkedFiles": [
        "src-tauri/src/store/mod.rs",
        "src-tauri/src/store/crypto.rs",
        "src-tauri/src/store/db.rs",
        "src-tauri/src/config/mod.rs",
        "src-tauri/src/command/mod.rs",
        "src-tauri/src/lib.rs",
        "src-tauri/src/types/stored.rs"
    ],
    "checkedInvariants": [
        "layering",
        "allowed-layers"
    ],
    "diffCoverage": {
        "changedFiles": [
            "src-tauri/src/store/mod.rs",
            "src-tauri/src/store/crypto.rs",
            "src-tauri/src/store/db.rs",
            "src-tauri/src/config/mod.rs",
            "src-tauri/src/command/mod.rs",
            "src-tauri/src/lib.rs"
        ],
        "reviewedFiles": [
            "src-tauri/src/store/mod.rs",
            "src-tauri/src/store/crypto.rs",
            "src-tauri/src/store/db.rs",
            "src-tauri/src/config/mod.rs",
            "src-tauri/src/command/mod.rs",
            "src-tauri/src/lib.rs"
        ],
        "uncoveredFiles": [],
        "coverage": 1,
        "notes": "Verified the forward-only layer order and dependency confinement for the new store layer and its command-layer orchestration."
    },
    "confidence": 0.9,
    "unreviewedRiskAreas": [
        "live-runtime-restore"
    ],
    "resolvedFindings": [],
    "requiredGates": [
        "tests"
    ],
    "findings": [
        {
            "severity": "medium",
            "rule": "done-requires-live-proof",
            "file": "src-tauri/src/store/db.rs",
            "evidence": "The contract smoke gate (cred_store_roundtrip: real keychain + AES-GCM roundtrip, ciphertext-on-disk assertion, relaunch auto-restore) is #[ignore] and has not been run. feature_list shows secure-cred-store passes:false / smoke done:false.",
            "fix": "Run the ignored live smoke and verify relaunch auto-restore on the GUI before flipping passes:true; record in the evidence bundle.",
            "blocking": false
        },
        {
            "severity": "info",
            "rule": "layering",
            "file": "src-tauri/src/store/mod.rs",
            "evidence": "store/ imports only crate::types (+ its own crypto submodule); rusqlite/keyring/aes-gcm appear only under src-tauri/src/store/ and zca-rust only under src-tauri/src/zalo/. config/store pre-exist in ADR-0003; native deps authorized by ADR-0005. The command->zalo->store->config->types DAG is acyclic and forward-only.",
            "fix": "No action; lift the in-command session store into session/ when session-manager lands (already tracked).",
            "blocking": false
        }
    ],
    "summary": "Architecture review of the new store layer + persistence wiring. Forward-only layering holds: store/ has no backward dependency on zalo/command; rusqlite/keyring/aes-gcm stay confined to store/ and zca-rust to zalo/; the credential triple and zca-rust types never rise into command or cross IPC. No unauthorized new layer (config + store pre-exist in ADR-0003; native/bundled deps authorized by ADR-0005). Changed files stay within the union of the features' allowedLayers {types,config,store,zalo,command} plus lib.rs wiring and the src/ UI (which reaches the core only via Tauri invoke/listen). architecture-fitness --strict passes. Decision is needs-human, not pass, because the contract's live smoke proof is #[ignore] and unrun. No blocking findings."
}